Attributes,Description
PRODUCT (L0),"This column represents the broadest level of product categorization, encompassing major categories such as Banking, CCPL & Other Unsecured, Deposits, Markets, Mortgages & Other Secured, Principal Finance, Transaction Services, Treasury, Un-Mapped, and Wealth Solutions. It serves as the primary grouping for product tracking, providing a macro view of the organization's offerings across diverse financial services and solutions. This level is crucial for understanding the overall structure and segmentation of products within the company."
PRODUCT (L1),"This column provides a secondary layer of product categorization, breaking down the L0 categories into more specific areas such as Banking Others, Capital Market & Advisory, Lending & Financial Solutions, Credit Trading, Macro Trading, and Securities & Prime Services. It further segments the broad product categories into distinct areas, allowing for a finer analysis of product offerings. This level is essential for identifying specific product types or services within the larger product divisions, including areas like CASA, Time Deposits, and Payments & Liquidity."
PRODUCT (L2),"This column offers a third layer of product categorization, detailing specific product types or services within the L1 areas, such as Advisory, Capital Markets, CRE (Commercial Real Estate), Financing Solutions, and Credit Flow. It breaks down the L1 categories into specialized units, which can include particular financial services or operational activities. This level is useful for detailed product analysis and for pinpointing specific offerings within the broader product context, including services like Personal Loans, SME Cash Management, and Structured Credit Trading."
PRODUCT (L3),"This column provides a detailed breakdown of products, specifying particular services or operational aspects such as Banking Input, ESG Advisory, FS Structured Rate Bonds, Credit Trading - CLO Charges & BSM, and Secured Lending WM. It allows for precise tracking and management of product data, enabling organizations to monitor and control offerings at a detailed level. This level is critical for product management, strategic planning, and operational accountability within specific product lines or services, covering a wide array of offerings like Auto, Mortgage Loans, and Trust & Fiduciary Services."
PRODUCT (L4),"This column provides further granularity by breaking down the L3 categories into even more specific product types or services, such as Clean Tech & Environment under M&A Advisory, CM CMS ABS Structured under CM CMS, and CRE PTC Distribution under CRE Private & Traded Credit. It allows for a finer analysis of product offerings, detailing particular aspects or sub-services within the broader L3 categories. This level is essential for pinpointing specific operational activities, financial instruments, or service variations, enabling precise tracking and management of product data across the organization."
PRODUCT_CRD_INDICATOR,"This column categorizes data according to different business views, such as Corporate and Institutional Banking (CIB), Wealth and Retail Banking (WRB), and Financial Planning and Analysis (FPNA). It enables users to analyze data from various perspectives, aligning with specific business needs and strategies."
PRODUCT_PK,Primary key for this dimension. Its defined by concatenating of all other attributes in the dimension
